{
  "$schema": "https://json-schema.org/draft/2020-12/schema",
  "type": "object",
  "additionalProperties": false,
  "required": [
    "id",
    "kind",
    "title",
    "aliases",
    "summary",
    "construction",
    "parameters",
    "assumptions",
    "known_decoders",
    "distance_methods",
    "relations",
    "evidence_refs",
    "source_refs",
    "updated_at"
  ],
  "properties": {
    "id": { "type": "string", "minLength": 1 },
    "kind": { "enum": ["code_family", "code_variant"] },
    "title": { "type": "string", "minLength": 1 },
    "family": { "type": "string" },
    "eczoo_ref": { "type": "string", "minLength": 1 },
    "aliases": {
      "type": "array",
      "items": { "type": "string" }
    },
    "summary": { "type": "string", "minLength": 1 },
    "construction": {
      "type": "object",
      "additionalProperties": false,
      "required": ["type", "description"],
      "properties": {
        "type": { "type": "string", "minLength": 1 },
        "description": { "type": "string", "minLength": 1 }
      }
    },
    "parameters": {
      "type": "object",
      "additionalProperties": { "type": ["string", "number", "boolean", "null"] }
    },
    "assumptions": {
      "type": "array",
      "items": { "type": "string" }
    },
    "known_decoders": {
      "type": "array",
      "items": { "type": "string" }
    },
    "distance_methods": {
      "type": "array",
      "items": { "type": "string" }
    },
    "relations": {
      "type": "array",
      "items": {
        "type": "object",
        "additionalProperties": false,
        "required": ["type", "target"],
        "properties": {
          "type": { "type": "string", "minLength": 1 },
          "target": { "type": "string", "minLength": 1 }
        }
      }
    },
    "evidence_refs": {
      "type": "array",
      "items": { "type": "string", "minLength": 1 }
    },
    "source_refs": {
      "type": "array",
      "items": { "type": "string", "minLength": 1 }
    },
    "updated_at": {
      "type": "string",
      "pattern": "^\\d{4}-\\d{2}-\\d{2}$"
    }
  },
  "allOf": [
    {
      "if": {
        "properties": {
          "kind": { "const": "code_variant" }
        }
      },
      "then": {
        "required": ["family"]
      }
    }
  ]
}
